"event","topic","question","options__001","options__002","options__003","options__004","answer","subtopic","difficulty","hint","explanation"
"Astronomy","Stellar Evolution & Lifecycles","Which star type ends life in a core-collapse supernova?","High-mass stars","Low-mass stars","White dwarfs","Brown dwarfs","High-mass stars","","Medium","Think stars heavier than ~8 solar masses.","High-mass stars (>8 M☉) explode as supernovae after fusion ceases in their cores."
"Astronomy","Stellar Evolution & Lifecycles","What is the primary energy source for a protostar?","Gravitational collapse","Hydrogen fusion","Helium fusion","Nuclear fission","Gravitational collapse","","Easy","Energy comes from contraction, not fusion.","A protostar shines due to energy released as it contracts under gravity before fusion begins."
"Astronomy","Stellar Evolution & Lifecycles","Which element marks the end of fusion in massive stars before supernova?","Carbon","Neon","Iron","Oxygen","Iron","","Hard","Fusion of this element consumes energy rather than producing it.","Iron cannot release energy via fusion, leading to core collapse and supernova."
"Astronomy","Stars & Classification","What does the spectral type of a star primarily indicate?","Mass","Temperature","Distance","Age","Temperature","","Easy","Remember the OBAFGKM sequence.","Spectral types classify stars by surface temperature and color, with O being hottest and M being coolest."
"Astronomy","Stars & Classification","Which type of star is the hottest main sequence star?","O-type","B-type","G-type","M-type","O-type","","Medium","Check the OBAFGKM order.","O-type stars are very hot, massive, and luminous."
"Astronomy","Stars & Classification","Which type of star is the coolest and least massive?","O-type","B-type","G-type","M-type","M-type","","Medium","It appears red in color.","M-type stars are red dwarfs, the coolest and smallest main sequence stars."
"Astronomy","Stars & Classification","What does the luminosity class of a star indicate?","Size and brightness","Mass","Distance","Rotation","Size and brightness","","Medium","It differentiates giants from dwarfs.","Luminosity class (I-V) categorizes stars by size and intrinsic brightness."
"Astronomy","Stars & Classification","Which spectral type is the Sun classified as?","O","B","G","M","G","","Easy","It is a yellow star.","The Sun is a G-type main sequence star (G2V)."
"Astronomy","Stars & Classification","A star with high luminosity but low temperature is classified as?","Red giant","White dwarf","Blue giant","Main sequence","Red giant","","Medium","It’s bright but cool.","Red giants are luminous due to large size, but have cooler surface temperatures."
"Astronomy","Stars & Classification","What is the relationship between a star’s color and temperature?","Red is hotter","Blue is cooler","Blue is hotter","Color does not indicate temperature","Blue is hotter","","Easy","Think of the hottest stars.","Blue stars are hottest, while red stars are coolest."
"Astronomy","Stars & Classification","Which class of stars are known as dwarfs?","Luminosity class V","Luminosity class I","Luminosity class III","Luminosity class II","Luminosity class V","","Medium","Main sequence stars fall here.","Class V corresponds to main sequence (dwarf) stars."
"Astronomy","Stars & Classification","Which star type is nearing the end of its life and has expanded in size?","Red giant","White dwarf","Blue giant","Protostar","Red giant","","Medium","It’s post-main-sequence.","Stars expand into red giants when hydrogen is exhausted in their cores."
"Astronomy","Stars & Classification","Which stars are located on the main sequence of the H-R diagram?","Red giants","White dwarfs","Blue supergiants","Stars fusing hydrogen in cores","Stars fusing hydrogen in cores","","Easy","Think energy source.","Main sequence stars are stable, fusing hydrogen into helium in their cores."
"Astronomy","Stars & Classification","Which spectral type has the strongest hydrogen absorption lines?","O","B","A","M","A","","Medium","Check the Balmer series.","A-type stars show the strongest Balmer hydrogen lines."
"Astronomy","Stars & Classification","Which of these is not a luminosity class?","I","III","V","G","G","","Easy","Luminosity classes are Roman numerals.","G is a spectral type, not a luminosity class."
"Astronomy","Stars & Classification","Blue giants are usually of which spectral type?","O and B","A and F","G and K","M","O and B","","Medium","Hot, massive stars.","Blue giants are massive, luminous, and hot, usually spectral types O or B."
"Astronomy","Stars & Classification","Red dwarfs have which properties?","High mass and luminosity","Low mass and temperature","Blue in color","Explode as supernovae","Low mass and temperature","","Easy","Think of the most common stars in the Milky Way.","Red dwarfs are low-mass, cool, and faint stars, making them the most common type."
"Astronomy","Stars & Classification","Which property primarily determines a star’s color?","Mass","Temperature","Age","Luminosity","Temperature","","Easy","Hot stars appear blue, cool stars red.","Surface temperature determines the color of a star."
"Astronomy","Stars & Classification","Which of these stars is the most luminous?","O-type supergiant","G-type main sequence","M-type dwarf","B-type subgiant","O-type supergiant","","Medium","Luminosity depends on size and temperature.","O-type supergiants are extremely luminous due to high mass and temperature."
"Astronomy","Stars & Classification","Which sequence represents spectral types from hottest to coolest?","OBAFGKM","MKGFBAO","GKMABFO","ABFGKMO","OBAFGKM","","Easy","Mnemonic: Oh Be A Fine Girl/Guy Kiss Me.","The standard OBAFGKM sequence orders stars from hottest to coolest."
"Astronomy","Stars & Classification","Which type of star has ceased core hydrogen fusion?","Red giant","Main sequence","Blue dwarf","Protostar","Red giant","","Medium","It’s post-main sequence.","Red giants have exhausted hydrogen in the core and are fusing helium or heavier elements."
"Astronomy","Stars & Classification","Which property is not part of spectral classification?","Temperature","Luminosity","Chemical composition","Distance","Distance","","Easy","Spectral classification is intrinsic.","Spectral classification depends on temperature, luminosity, and composition, not distance."
"Astronomy","Exoplanets & Planetary Systems","What is a 'hot Jupiter'?","A small rocky planet close to its star","A gas giant close to its star","A gas giant far from its star","A planet still forming","A gas giant close to its star","","Medium","Name gives away its properties.","Hot Jupiters are gas giants similar to Jupiter but orbit very close to their host star."
"Astronomy","Exoplanets & Planetary Systems","Which method detects exoplanets by measuring star brightness dips?","Radial velocity","Transit photometry","Astrometry","Gravitational microlensing","Transit photometry","","Easy","Look for changes in light over time.","Transit photometry detects planets by observing the dip in brightness when a planet passes in front of its star."
"Astronomy","Exoplanets & Planetary Systems","The radial velocity method detects exoplanets by measuring?","Star wobble","Planet size","Transit duration","Planet atmosphere","Star wobble","","Medium","Doppler effect is used.","The star moves slightly due to gravitational pull from the planet, which causes measurable Doppler shifts in its spectrum."
"Astronomy","Exoplanets & Planetary Systems","Kepler’s Third Law relates which two quantities?","Star mass and planet radius","Orbital period and semi-major axis","Planet mass and distance","Star luminosity and temperature","Orbital period and semi-major axis","","Medium","P² = a³ for solar mass stars.","Kepler’s Third Law states that the square of the orbital period is proportional to the cube of the semi-major axis."
"Astronomy","Exoplanets & Planetary Systems","Which planet type is most likely to be detected using transit photometry?","Large close-in planets","Small distant planets","Small close-in planets","Gas giants far from star","Large close-in planets","","Easy","Biggest effect on brightness.","Large planets close to their stars block more light, making transits easier to detect."
"Astronomy","Exoplanets & Planetary Systems","Which detection method measures a star’s position changes in the sky due to orbiting planets?","Radial velocity","Transit photometry","Astrometry","Gravitational microlensing","Astrometry","","Medium","Precise positional shifts.","Astrometry measures tiny shifts in a star's position caused by gravitational pull of planets."
"Astronomy","Exoplanets & Planetary Systems","Gravitational microlensing detects exoplanets by?","Measuring star wobble","Observing brightness amplification of background star","Transit dips","Direct imaging","Observing brightness amplification of background star","","Hard","A lensing effect due to gravity.","A planet’s gravity bends light from a background star, temporarily brightening it."
"Astronomy","Exoplanets & Planetary Systems","What defines a planet as 'Earth-like'?","Size and composition similar to Earth","Orbiting far from star","Gas giant composition","No atmosphere","Size and composition similar to Earth","","Easy","Consider rocky planets.","Earth-like planets are rocky, with sizes and masses similar to Earth."
"Astronomy","Exoplanets & Planetary Systems","Which exoplanet was the first discovered around a Sun-like star?","51 Pegasi b","Kepler-22b","HD 209458 b","Proxima Centauri b","51 Pegasi b","","Medium","Discovered in 1995.","51 Pegasi b was the first exoplanet found orbiting a main-sequence star using radial velocity."
"Astronomy","Exoplanets & Planetary Systems","Which characteristic is common for a 'super-Earth' planet?","Mass between Earth and Neptune","Smaller than Mercury","Gas giant composition","Orbiting multiple stars","Mass between Earth and Neptune","","Medium","Not a gas giant, bigger than Earth.","Super-Earths have masses higher than Earth but less than Neptune, usually rocky."
"Astronomy","Exoplanets & Planetary Systems","A planet with high eccentricity has what kind of orbit?","Circular","Elliptical","Parabolic","Hyperbolic","Elliptical","","Medium","Distance varies along the orbit.","Eccentric orbits are elongated (elliptical) rather than circular."
"Astronomy","Exoplanets & Planetary Systems","Which type of planet is more likely to have a hydrogen-rich atmosphere?","Gas giants","Rocky planets","Ice dwarfs","Terrestrial planets","Gas giants","","Easy","Think Jupiter and Saturn.","Gas giants primarily consist of hydrogen and helium with thick atmospheres."
"Astronomy","Exoplanets & Planetary Systems","What is the habitable zone?","Region where liquid water can exist","Distance where planets are gas giants","Region with strong stellar winds","Region with no gravity","Region where liquid water can exist","","Easy","Also called the 'Goldilocks zone.'","The habitable zone is the orbital region around a star where temperatures allow liquid water to exist on a planet's surface."
"Astronomy","Exoplanets & Planetary Systems","Which property is measured in radial velocity method?","Star velocity along line of sight","Distance to planet","Planet radius","Transit duration","Star velocity along line of sight","","Medium","Uses Doppler shifts.","The radial velocity method detects the star's motion toward or away from Earth due to a planet's gravity."
"Astronomy","Exoplanets & Planetary Systems","Which property primarily determines a planet's surface temperature?","Distance from star","Mass","Rotation speed","Orbit shape","Distance from star","","Easy","Closer means hotter.","The planet's surface temperature depends mainly on its distance from the host star."
"Astronomy","Exoplanets & Planetary Systems","A planet transiting its star causes what in the observed light curve?","Increase in brightness","Decrease in brightness","No change","Oscillations","Decrease in brightness","","Easy","Blockage of starlight.","During a transit, the planet blocks a fraction of light, causing a dip in the light curve."
"Astronomy","Exoplanets & Planetary Systems","Which of the following is a method to find exoplanets indirectly?","Direct imaging","Transit photometry","Space telescope imaging","Stellar photography","Transit photometry","","Medium","Detect planets by their effect on the star.","Transit photometry detects planets by the light dimming they cause when passing in front of the star."
"Astronomy","Exoplanets & Planetary Systems","Which is true for planets in multi-star systems?","All have circular orbits","Orbits can be stable or unstable","Cannot exist","All are gas giants","Orbits can be stable or unstable","","Hard","Gravitational interactions matter.","Planets in multi-star systems may have stable or unstable orbits depending on stellar distances and configurations."
"Astronomy","Exoplanets & Planetary Systems","Which planet type can be found in both inner and outer planetary systems?","Terrestrial planets","Gas giants","Brown dwarfs","Hot Jupiters","Terrestrial planets","","Medium","Rocky planets can be close or far.","Terrestrial planets are rocky and may exist close or moderately far from their stars."
"Astronomy","Exoplanets & Planetary Systems","The discovery of exoplanets has shown that planetary systems are?","All like our solar system","Highly varied","All have hot Jupiters","Only terrestrial planets","Highly varied","","Medium","Different from early expectations.","Exoplanet discoveries show planetary systems can have a wide range of planet types and orbital configurations."
"Astronomy","Stellar Evolution","What is the primary factor that determines a star's life cycle?","Initial mass","Rotation speed","Chemical composition","Age","Initial mass","","Easy","Mass at birth dictates its future.","A star's initial mass determines its luminosity, lifespan, and final state (white dwarf, neutron star, or black hole)."
"Astronomy","Stellar Evolution","A protostar generates energy mainly through?","Hydrogen fusion","Gravitational collapse","Lithium burning","Nuclear fission","Gravitational collapse","","Easy","Fusion hasn’t started yet.","Before nuclear fusion, a protostar radiates energy from the conversion of gravitational potential energy into heat."
"Astronomy","Stellar Evolution","Main sequence stars primarily fuse which element?","Hydrogen","Helium","Carbon","Oxygen","Hydrogen","","Easy","Most of a star’s life is spent in this phase.","Main sequence stars fuse hydrogen into helium in their cores to generate energy."
"Astronomy","Stellar Evolution","What stage comes after a red giant for a low-mass star?","White dwarf","Neutron star","Black hole","Protostar","White dwarf","","Medium","Star sheds outer layers, leaving a dense core.","Low-mass stars expel their outer layers as planetary nebulae and leave behind a white dwarf."
"Astronomy","Stellar Evolution","High-mass stars end their life as?","White dwarfs","Neutron stars or black holes","Protostars","Red dwarfs","Neutron stars or black holes","","Medium","Depends on how massive the core is.","Stars with initial mass >8 M☉ may form neutron stars or black holes after a supernova."
"Astronomy","Stellar Evolution","What causes a supernova?","Core collapse of massive star","Ignition of hydrogen fusion","Formation of planetary nebula","Stellar rotation","Core collapse of massive star","","Medium","Explosion from core instability.","A supernova occurs when the core of a massive star collapses under gravity, causing a powerful explosion."
"Astronomy","Stellar Evolution","During the red giant phase, what happens to the star's core?","It shrinks and heats up","It expands and cools","It becomes gaseous","It remains the same","It shrinks and heats up","","Medium","Core contracts while outer layers expand.","The core contracts and heats, while the outer layers expand and cool, giving the star a red appearance."
"Astronomy","Stellar Evolution","Which phase is characterized by helium fusion into carbon?","Main sequence","Red giant","Supernova","White dwarf","Red giant","","Medium","Fusion after hydrogen is depleted.","In the red giant phase, the star fuses helium into carbon and oxygen in the core."
"Astronomy","Stellar Evolution","What is the Chandrasekhar limit?","Maximum mass of a white dwarf","Minimum mass of a neutron star","Maximum mass of a star","Mass of Sun","Maximum mass of a white dwarf","","Hard","Approximately 1.44 M☉.","The Chandrasekhar limit (~1.44 M☉) is the maximum mass a white dwarf can have before collapsing into a neutron star."
"Astronomy","Stellar Evolution","What is a planetary nebula?","Ejected outer layers of a star","A small planet forming","A black hole","A red dwarf","Ejected outer layers of a star","","Easy","Not related to planets despite the name.","Planetary nebulae are shells of gas ejected by low- to intermediate-mass stars near the end of their lives."
"Astronomy","Stellar Evolution","Which stars have the longest lifetimes?","Red dwarfs","Blue giants","Sun-like stars","White dwarfs","Red dwarfs","","Easy","Small and cool stars burn fuel slowly.","Red dwarfs burn hydrogen slowly and can live for hundreds of billions of years."
"Astronomy","Stellar Evolution","What is a neutron star primarily composed of?","Neutrons","Protons","Electrons","Hydrogen","Neutrons","","Medium","Densest stable matter.","Neutron stars are extremely dense objects mainly composed of neutrons formed after supernova collapse."
"Astronomy","Stellar Evolution","What is the approximate temperature of the core of the Sun where fusion occurs?","15 million K","5,800 K","1 million K","100 million K","15 million K","","Medium","Much hotter than the surface.","The core of the Sun reaches ~15 million K, allowing hydrogen fusion to occur."
"Astronomy","Stellar Evolution","Which process converts helium into carbon and oxygen in stars?","Triple-alpha process","Proton-proton chain","CNO cycle","Beta decay","Triple-alpha process","","Hard","Helium fusion in red giants.","The triple-alpha process fuses three helium nuclei into carbon, with some forming oxygen."
"Astronomy","Stellar Evolution","Which factor affects how fast a star evolves off the main sequence?","Mass","Color","Distance from Earth","Rotation","Mass","","Medium","Bigger stars burn fuel faster.","Higher-mass stars have shorter lifetimes because they burn fuel at higher rates."
"Astronomy","Stellar Evolution","What is the primary source of energy in a white dwarf?","Residual heat","Nuclear fusion","Gravitational collapse","Chemical reactions","Residual heat","","Medium","Fusion has stopped.","White dwarfs no longer fuse elements; they shine due to residual thermal energy."
"Astronomy","Stellar Evolution","What is a black hole?","An object with gravity so strong not even light can escape","A dark star","A neutron star","A red giant","An object with gravity so strong not even light can escape","","Medium","Event horizon concept.","A black hole is a region of spacetime with gravity strong enough to prevent light from escaping."
"Astronomy","Stellar Evolution","Which phase occurs after helium is exhausted in massive stars?","Carbon fusion","Hydrogen burning","Red giant","White dwarf","Carbon fusion","","Hard","Next stage of fusion in massive stars.","Massive stars fuse heavier elements sequentially: helium → carbon → oxygen → silicon until iron accumulates in the core."
"Astronomy","Stellar Evolution","Which force balances gravity in a main sequence star?","Radiation pressure from fusion","Magnetic pressure","Centrifugal force","Dark energy","Radiation pressure from fusion","","Medium","Prevents collapse during life.","The outward pressure from nuclear fusion balances gravity, keeping the star stable on the main sequence."
"Astronomy","H-R Diagram & Stellar Classification","What are the two axes of the Hertzsprung-Russell diagram?","Luminosity vs Temperature","Mass vs Radius","Distance vs Brightness","Velocity vs Age","Luminosity vs Temperature","","Easy","Think of brightness and heat.","The H-R diagram plots stellar luminosity (or absolute magnitude) on the vertical axis and surface temperature (or spectral type) on the horizontal axis."
"Astronomy","H-R Diagram & Stellar Classification","Which spectral class represents the hottest stars?","O","B","A","M","O","","Easy","Remember OBAFGKM.","O-type stars are the hottest and most massive stars, with blue color."
"Astronomy","H-R Diagram & Stellar Classification","Which spectral class represents cool, red stars?","M","F","G","B","M","","Easy","Coolest in the OBAFGKM sequence.","M-type stars are the coolest, red in color, often red dwarfs or red giants."
"Astronomy","H-R Diagram & Stellar Classification","A star in the upper-left of the H-R diagram is likely:","Hot and luminous","Cool and dim","Hot and dim","Cool and luminous","Hot and luminous","","Medium","Top-left means high luminosity and high temperature.","Upper-left stars are massive, bright, and hot, often O or B type giants or supergiants."
"Astronomy","H-R Diagram & Stellar Classification","Main sequence stars are located along which region of the H-R diagram?","Diagonal from top-left to bottom-right","Top-right corner","Bottom-left corner","Center only","Diagonal from top-left to bottom-right","","Medium","Most stars lie here during their hydrogen-burning phase.","The main sequence runs diagonally from hot, luminous stars to cool, dim stars."
"Astronomy","H-R Diagram & Stellar Classification","Which type of star appears in the lower-left region of the H-R diagram?","White dwarfs","Red giants","Supergiants","Protostars","White dwarfs","","Medium","Hot but low luminosity.","White dwarfs are small, hot, and dim, located in the lower-left of the H-R diagram."
"Astronomy","H-R Diagram & Stellar Classification","The Sun belongs to which spectral type?","G","K","F","M","G","","Easy","Yellow main-sequence star.","The Sun is a G-type main-sequence star (G2V), moderately hot and luminous."
"Astronomy","H-R Diagram & Stellar Classification","Which stellar property is most closely related to a star’s color?","Surface temperature","Mass","Age","Luminosity","Surface temperature","","Easy","Blue vs red color.","Star color indicates surface temperature: blue = hot, red = cool."
"Astronomy","H-R Diagram & Stellar Classification","What does a star’s luminosity measure?","Total energy output per second","Size of the core","Mass","Distance from Earth","Total energy output per second","","Easy","Brightness intrinsic to the star.","Luminosity is the total energy a star emits per unit time."
"Astronomy","H-R Diagram & Stellar Classification","Which class of stars is more luminous than main sequence stars of the same temperature?","Giants","White dwarfs","Red dwarfs","Protostars","Giants","","Medium","They have expanded outer layers.","Giant stars have large radii and therefore higher luminosity at similar temperatures."
"Astronomy","H-R Diagram & Stellar Classification","Which class of stars is less luminous than main sequence stars of the same temperature?","White dwarfs","Red giants","Supergiants","Blue giants","White dwarfs","","Medium","Small but hot stars.","White dwarfs are hot but small, giving them low luminosity."
"Astronomy","H-R Diagram & Stellar Classification","What is the spectral sequence from hottest to coolest stars?","O, B, A, F, G, K, M","M, K, G, F, A, B, O","G, K, M, O, B, A, F","A, B, O, M, K, G, F","O, B, A, F, G, K, M","","Easy","Mnemonic: Oh Be A Fine Girl/Guy, Kiss Me","OBAFGKM is the standard spectral classification from hottest to coolest."
"Astronomy","H-R Diagram & Stellar Classification","What property primarily determines a star's position along the main sequence?","Mass","Age","Rotation","Metallicity","Mass","","Medium","More massive stars are hotter and brighter.","Mass dictates temperature and luminosity, determining a star's main sequence position."
"Astronomy","H-R Diagram & Stellar Classification","A star that moves off the main sequence becomes a:","Giant or supergiant","White dwarf","Protostar","Neutron star","Giant or supergiant","","Medium","Hydrogen burning in the core has ended.","Stars expand into giants or supergiants after exhausting core hydrogen."
"Astronomy","H-R Diagram & Stellar Classification","Which type of star appears in the top-right corner of the H-R diagram?","Red supergiants","Blue dwarfs","White dwarfs","Protostars","Red supergiants","","Medium","Cool but very luminous.","Top-right stars are large, cool, and very luminous, like red supergiants."
"Astronomy","H-R Diagram & Stellar Classification","What does the absolute magnitude of a star represent?","Intrinsic brightness","Apparent brightness","Temperature","Distance","Intrinsic brightness","","Easy","Brightness if all stars were 10 parsecs away.","Absolute magnitude measures a star’s intrinsic brightness independent of distance."
"Astronomy","H-R Diagram & Stellar Classification","Stars cooler than 3,500 K are usually of which color?","Red","Yellow","White","Blue","Red","","Easy","Red dwarfs and giants.","Cool stars emit most energy in red wavelengths, appearing red."
"Astronomy","H-R Diagram & Stellar Classification","Which property is NOT shown on a standard H-R diagram?","Distance","Luminosity","Temperature","Spectral type","Distance","","Easy","H-R diagrams are intrinsic properties only.","H-R diagrams plot intrinsic stellar properties; distance to the star is not shown."
"Astronomy","H-R Diagram & Stellar Classification","What happens to a star’s luminosity as it evolves into a red giant?","Increases","Decreases","Remains the same","Becomes zero","Increases","","Medium","Outer layers expand and brighten.","As a star expands into a red giant, its luminosity increases even though surface temperature decreases."
